{"evaluators":[{"algorithm":"ed25519","evaluator":"urn:jinn:benchmark-product:local-venue:evaluator-1","keyId":"benchmark-product-verdict-dc8dbb6d84571890","spkiDerBase64":"MCowBQYDK2VwAyEAZEVzslPLEf5wiZGdgBwMkfXNulBCRTIAj5Gkxqj8xsw="}],"format":"benchmark-product-public-trust/2","report":{"algorithm":"ed25519","author":"did:key:z6MkiTfZS4EM9K1fczmhpcmi1YxDdtURfuPWJrCSofeTwYFX","didKey":"did:key:z6MkiTfZS4EM9K1fczmhpcmi1YxDdtURfuPWJrCSofeTwYFX","keyId":"did:key:z6MkiTfZS4EM9K1fczmhpcmi1YxDdtURfuPWJrCSofeTwYFX","spkiDerBase64":"MCowBQYDK2VwAyEAPB6c++A+XR8TEe+hbDtgXNbct2b19zbpmV1KiVLK59g=","validFrom":"2026-08-18T11:41:56.880Z"},"selfRun":{"custody":"workspace-minted","evaluatorDistinctness":"agent-distinctness-only","partyIndependence":"not-established"}}